<?xml version="1.0" encoding="UTF-8"?>
<xs:schema xmlns:xs="http://www.w3.org/2001/XMLSchema">
    <xs:element name="bloodDonation">
        <xs:complexType>
            <xs:sequence>
                <xs:element name="organization">
                    <xs:complexType>
                        <xs:sequence>
                            <xs:element name="name" type="xs:string"/>
                            <xs:element name="address" type="xs:string"/>
                            <xs:element name="contact" type="xs:string"/>
                        </xs:sequence>
                    </xs:complexType>
                </xs:element>
                <xs:element name="donor">
                    <xs:complexType>
                        <xs:sequence>
                            <xs:element name="name" type="xs:string"/>
                            <xs:element name="age">
                                <xs:simpleType>
                                    <xs:restriction base="xs:integer">
                                        <xs:minInclusive value="18"/>
                                        <xs:maxInclusive value="65"/>
                                    </xs:restriction>
                                </xs:simpleType>
                            </xs:element>
                            <xs:element name="bloodType">
                                <xs:simpleType>
                                    <xs:restriction base="xs:string">
                                        <xs:enumeration value="O+"/>
                                        <xs:enumeration value="O-"/>
                                        <xs:enumeration value="A+"/>
                                        <xs:enumeration value="A-"/>
                                        <xs:enumeration value="B+"/>
                                        <xs:enumeration value="B-"/>
                                        <xs:enumeration value="AB+"/>
                                        <xs:enumeration value="AB-"/>
                                    </xs:restriction>
                                </xs:simpleType>
                            </xs:element>
                        </xs:sequence>
                    </xs:complexType>
                </xs:element>
                <xs:element name="donation">
                    <xs:complexType>
                        <xs:sequence>
                            <xs:element name="date" type="xs:date"/>
                            <xs:element name="volume">
                                <xs:simpleType>
                                    <xs:restriction base="xs:integer">
                                        <xs:minInclusive value="250"/>
                                        <xs:maxInclusive value="500"/>
                                    </xs:restriction>
                                </xs:simpleType>
                            </xs:element>
                        </xs:sequence>
                    </xs:complexType>
                </xs:element>
            </xs:sequence>
        </xs:complexType>
    </xs:element>
</xs:schema>
