<?xml version="1.0" encoding="UTF-8"?>
<?xml-stylesheet type="text/xsl" href="blood_donation.xsl"?>
<!DOCTYPE bloodDonation [
    <!ENTITY orgName "Red Cross Society">
    <!ENTITY orgAddress "3rd Cross, Further Mahalaxmi Extension">
    <!ENTITY orgContact "021-590059">
    <!ENTITY donorName "Joseph James">
    <!ENTITY donorAge "30">
    <!ENTITY donorBloodType "O+">
    <!ENTITY donationDate "2024-08-07">
    <!ENTITY donationVolume "500">
]>
<bloodDonation xmlns:xsi="http://www.w3.org/2001/XMLSchema-instance" xsi:noNamespaceSchemaLocation="blood_donation.xsd">
    <organization>
        <name>&orgName;</name>
        <address>&orgAddress;</address>
        <contact>&orgContact;</contact>
    </organization>
    <donor>
        <name>&donorName;</name>
        <age>&donorAge;</age>
        <bloodType>&donorBloodType;</bloodType>
    </donor>
    <donation>
        <date>&donationDate;</date>
        <volume>&donationVolume;</volume>
    </donation>
</bloodDonation>
